review,sentiment
"I really liked this movie. Kurt manages to act without speaking, letting moments speak for themselves. He doesn't have to verbalize or rationalize his actions, he simply decides and takes action. He is supported by a good cast of actors and settings, and is able to show us a more humane side of soldiers without getting to corny.",positive
"Rented the video with a lot of expectations, but it was a disappointment. The story didn't make sense, the plot was very weak and the special effects.. well, I think even I can do better with my home computer. Sorry. Missed a change here.",negative
"Great entertainment from start to the end. Wonderful performances by Belushi, Beach, Dalton & Railsback. Some twists and many action scenes. The movie was made for me! Funny lines in the screenplay, good music. Dalton as the tough sheriff and Railsback as ""redneck-villain"". I must recommend this film to every action-adventure fan! 10/10",positive
"I did not like this film at all: The scenario is boring - and after a while, its primitive predictability really gets on your nerves. Even if you give Chabrol a high bonus for not being a beginner, I did not manage to find anything specially interesting on his characterization of Mika neither.",negative
"Excellent performances and a solid, but not overplayed story, helped this movie exceed my expectations. This movie was far better than I was expecting after some of the reviews I had read - but frankly those reviewers just got it wrong. Very inspiring and uplifting. Highly recommended!",positive
"Like another reviewer said, this movie is not a heavy melodrama, but it deals with harsh realities. A very very playful movie that does not dwell for a moment. Some very good acting and some wonderful smiles as well.",positive
This is a true gem of corny sci-fi! Peter Cushing adds a great personality to this midnite movie classic.<br /><br />I particularly like the sound design. The weird choppy voices of the creatures and the rhino creatures all provide a bizarre backdrop (Of course the scantily clad babe doesn't hurt either!)<br /><br />,positive
"It looks to me as if the creators of ""The Class Of Nuke 'Em High"" wanted it to become a ""cult"" film, but it ends up as any old high school B-movie, only tackier. The satire feels totally overshadowed by the extremely steretyped characters. It's very un-funny, even for a turkey.",negative
"A professional production with quality actors that simply never touched the heart or the funny bone no matter how hard it tried. The quality cast, stark setting and excellent cinemetography made you hope for Fargo or High Plains Drifter but sorry, the soup had no seasoning...or meat for that matter. A 3 (of 10) for effort.",negative
"Screening as part of a series of funny shorts at the Sydney Gay and Lesbian Mardi Gras film festival, this film was definitely a highlight. The script is great and the direction and acting was terrific. As another posting said, the actors' comedic timing really made this film. Lots of fun.",positive
"I own this movie. I've seen it over 20 times and every time I still get weepy. Its a Great love story, surprises, and you can definately feel chemistry between Klein and Sobiesky. I definately give this movie a perfect 10. I recommend this to anyone.",positive
"I found the movie to be very light and enjoyable. One knows that the story is not real life like, yet the depiction is superb.<br /><br />Lyrics are really good and John Travolta in his usual style. I like the scene wherein he as an angel gives up his own stuff to bring life back to the dog.",positive
"One of the better teen comedies to be filmed during the 80's, Valley Girl has a young Nicolas Cage in a starring role. Deborah Foreman is fun as the object of Cage's desire (and whatever happened to her?). Look for veteran actors Colleen Camp and Frederic Forrest as Julie's hippie parents - they're quite funny!",positive
"Lame, ridiculous and absurd. My 6 year old son talked us into watching this rubbish. Tripe stereotypes and themes not appropriate for children. The antithesis of the commercialism of Christmas is not socialism it's Jesus.",negative
"This film has the look and feel of a Student film project. Yeah, there are some interesting (albeit gimmicky) edits and shots, but the end result was juvenile.<br /><br />The director didn't seem to be saying ""Look at this film."" It seemed as if he were saying, ""Look at ME! I'm a DIRECTOR!""<br /><br />Thumbs down.",negative
"This should have been a short film, nothing more. The Length of 1,5 hours is much too long, because after 10 minutes you have seen almost every joke. It's getting more and more on your nerves untill you finally kick out your brain to endure that movie.<br /><br />To do yourself a favor, don't mention to see that movie...",negative
"Sam Firstenberg's ""Ninja 3:The Domination"" mixes martial arts with ""The Exorcist"" like horror.The horror elements thrown on screen are simply laughable,but the film works as a mindless action/martial arts flick.The fight scenes are well-choreographed and exciting,and the film is never boring.So forget stupid dialogue,lame acting and annoying soundtrack-grab some beer and check this one out!Highly recommended!",positive
"Great battle finale and nice sets help keep this often-slow movie enjoyable. At times it had me checking my watch, although there were enough memorable moments to make the film stand out in my mind days after watching it. The ending should surprise even those familiar with the Nibelungen story line.",positive
"This movie was thought to be low budget but it turned out to be awesome. I just rented it from blockbuster and i loved it. The acting was very good, hot women and some scary parts. It is plain and simply worth the money to pay for.",positive
"Predictable plot. Simple dialogue. Shockingly unemotional performances. But Robert Downey, Jr. is so cute, I gave this ""poor man's afternoon special"" a 3 instead of the 1 or 2 it so richly deserved.",negative
The first half of this film held some promise as it seemed like the film was going to be a low-key character psychodrama like THE MINUS MAN but then the whole thing collapses into cliche and the viewer slowly loses all interest. There's a decent cast here but the film is lifeless and the talent completely wasted.,negative
"Shame to see an interesting story diluted into standard ""Vietnam made for TV"" fare. Usually HBO movies are a substantial cut above TV. Bill Paxton was a pretty good choice for the lead role, but wasn't given much to work with.",negative
"its not as good as the first movie,but its a good solid movie its has good car chase scenes,on the remake of this movie there a story for are hero to drive fast as his trying to rush to the side of his ailing wife,the ending is great just a good fair movie to watch in my opinion,<br /><br />",positive
"This entry is certainly interesting for series fans (like myself), but yet it is mostly incomprehensible. The plot is confusing, as is the sequel continuity. Some striking effects, to be sure, but we never find out what it all really means.<br /><br />Try to see the ""NC-17"" workprint version which contains the gore that was cut to be re-rated ""R"".",negative
"I have fond memories of watching this when it came out. It's one of those films that you know is rubbish, even when you're a kid, but at that age you overlook the ludicrous acting, special effects and plot (so there's a race of big-busted nymphets living underground, huh?) and just enjoy the campy monsters for all they're worth.",positive
I hope she can keep acting and directing. She's surely up to the task and could easily develop that visionary streak into a long career of unconventional and rare works of art. Her work has a rare kind of generosity and her timing is spot-on! Oy I'm kvell,positive
"Superb! Even the Author was laughing at the end. And what a ""balcony"" scene! This film has it all. Wickedly funny and yet strangely faithful to the Bard of Avon. (But NOT for the Faint of Heart!) AND... the Best Credits since Monty Python and The Holy Grail! I am ""Troma""Tized!",positive
"This movie will confuse you to death. Furthermore, if your a Denise Richards' fan, don't even think of renting this movie. Besides getting top billing by being on the cover and about 10 minutes of air time if that, she has nothing to do with the movie or the many messed up plots.",negative
"What does this movie have? Lots of gunfire and expensive effects. Nothing makes sense on any other level.<br /><br />Watching Arnold cry is seeing acting so bad that it is laughable. The plot is ludicrous.<br /><br />If you think the Devil will be impressed by a bad actor with a machine gun, well, this movie is for you!",negative
"This was truly a heart warming movie. It is filled with so many messages. Loyalty, friendship, sickness, death, and the paranoia society has concerning anything they don't understand. I have shed a few tears during certain movies, but this movie kept the tears flowing.",positive
this movie is certainly worth a watch. it's full of action. it's also humorous. you'll laugh until your stomach hurts if you watch this movie. this movie also includes lots of hi-tech things hence the name gen-y. i recommend you to watch the prequel of this movie which is gen-x.,positive
"Steve Martin looks like he's had a face lift. Something very strange about his face. I usually like anything Steve does, but this movie comes off as trashy not funny. Didn't think Charlene encouraging him to be rough with his wife was a good message to be sending out to teens watching this film.",negative
"Don't waste your time and money on it. It's not quite as bad as ""Adrenalin"", by the same director but that's not saying much.",negative
"bad acting, bad southern accents, inconsistent cinematography, horrible script...<br /><br />I was looking forward to this film at a recent film festival and was so discouraged after seeing it. It contains quote/unquote name talent, but they do not deliver. Of course the basis for this is the uneven and uninteresting story that is told.<br /><br />don't bother",negative
"The last good Ernest movie, and the best at that. How can you not laugh at least once at this movie. The last line is a classic, as is Ernest's gangster impressions, his best moment on film. This has his best lines and is a crowning achievement among the brainless screwball comedies.",positive
"Aside from the horrendous acting and the ridiculous and ludicrous plot, this movie wasn't too bad. Unfortunately, that doesn't leave much movie not to suck. Do not waste your time on this film, even if you find yourself suffering from insomnia, as I did. Watch an infomercial instead.",negative
"In this 4th Child's Play film, Chucky gets lucky. It's very funny and there are some enjoyable parts. Very good direction. Not as bad as it could be. The best one in the series since the first. Three stars out of four.",positive
"What about DJ Cash Money??? This film fails in part by not covering the mid to late 80s. There was only a small mention of DJ Cheese in 86.<br /><br />Also, it's Grandmixer ""DST"", not ""DXT""!!!!!",positive
"This movie was in one word. Terrible. First of all the people who invented that thingie that puts you in the TV, are slightly insane! Secondly, the three teens are so obsessed with the show, it's scary! The movie was stupid, and no effort or thought was put into it!",negative
"This movie blew me away. If you can see only one of the animated bug movies this year see this one instead of Antz. the plot, characters, and jokes are better in A Bugs life. Also when you go stay in your seat until the end of the credits. it's the best part of the movie. Rating 9",positive
"Pakeezah is in my mind the greatest achievement of Indian cinema. The film is visually overwhelming but also emotionally breathtaking. The music, the songs, the sets, the costumes, the cinematography, in fact every creative element is worthy of superlatives.",positive
"I was particularly moved by the understated courage and integrity of l'Anglaise, in this beautifully acted, intellectually and visually compelling film. Thank you so much, Monsieur le directeur Rohmer.",positive
"along with it's partner, this is the greatest piece of animation ever created. the images and styles are amazing, and match perfectly with the story which is a brilliantly realistic reinterpretation of our own world, where is has been, and where it could go. quite affecting and sometimes painful to watch, it it a masterpiece of the visual art.",positive
"Oh, well, this movie starts off well. It's kinda funny and seems like it could be a fun movie. Then it becomes a bit serious and goes off the rails. It sort of wants to be 'Boogie Nights' but it can't achieve it. If only it stayed with the tone of the first quarter of the film...",negative
"I have never seen such terrible performances in all my life.<br /><br />Everyone in the entire film was absolute rubbish.<br /><br />Not one decent actor/actress in the whole film, it was a joke.<br /><br />Reminded me of drama at school...",negative
"After looking at monkeys (oops apes) for more than one hour, I was feeling like one too. I was an ape, spending money on this movie. Please people, hold you money in your pocket and go see some funny movie like Bridget Jones's Diary..",negative
"Ruth Gordon at her best. This episode is my favorite of the whole Columbo series. Peter Falk and Ruth Gordon worked so well together that they should both be inducted into the television hall of fame, regardless of the rest of their work. Even the music was outstanding in this episode.",positive
"If you want to see a true thriller, rent this!!! It's not from the director or screenwriter of ""Scream"", doesn't feature overacting, overpaid ""TV"" actors passing off as ""stars"", and is not a run of the mill special effects bonanza. Instead you'll get a top-notch, edgy, very strong (in violence) yet thrilling nailbiter.",positive
"Read the book, forget the movie!",negative
I really liked this movie despite one scene that was pretty bad (the one when Samantha and Nick are flirting in the hotel). The story is so cool and can't wait to read the book! Bravo for the super station!,positive
Worst pile of drivel to date! Everyone involved with this production should be ashamed of themselves. Not one single element of the movie was anything slightly like an original idea. A first grader telling you a story about nap time is more entertaining.,negative
"No artful writeup here because it doesn't deserve one. Not an art film. Not even one of those 'hidden' gems. You know, like those movies you hear about through a friend who saw this amazing movie downtown where they show all the good independents and art films.<br /><br />Just pack it into the christmas boxes, and dispose of quickly.",negative
"Annoying, static comedy with a painfully miscast Peter Sellers as a smarmy, self-centered Casanova who always has his way with the ladies. A major blemish on Sellers' filmography, and, even worse, a film that seems to have been made solely to satisfy the ego of its star. (*)",negative
This is supposed to be well-researched and based on fact. How come therefore that it's so packed with McGovernisms. Did the people of Derry live in some kind of bizarre Philip K. Dick world in which reality was uncannily like Cracker/ Liam/ Priest? Or is McGovern an idle hack who just keeps repeating hims,negative
One of the worst films of it's genre.<br /><br />The only bright spots were Lee Merriwether showing some of the sparkle she would later bring to the Time Tunnel and Batman.<br /><br />A young Patty Duke also outshone the more established actors.<br /><br />,negative
"Being a Harrison Ford fan I am probably being kind. It was predictable, sappy...my husband made a lot of gagging sounds while we were watching it. What a disappointing movie. Our local newspaper (San Jose Mercury News) actually gave this 4 stars out of 4 stars!!! Hard to believe that the reviewer saw the same movie we did.",negative
This is a great movie. Too bad it is not available on home video.,positive
"...about this film was the title song. After 30 minutes, I discontinued watching because it was so lame. Bad story, bad actors, bad movie. If you want to watch a good movie, watch Pulp Fiction instead.",negative
"The little girl Desi is so adorable... I cant think of a more beautiful story then this one here. It will make you cry, laugh, and believe. Knowing that this was based on a true story just made me gasp and it also made me realize that there are nice people out there. Great cast and an overall great movie.",positive
"After a big tip of the hat to Spinal Tap, this movie is hilarious. Anyone who grew up watching MTV will love it and if you didn't, rent it anyway,the ""My Peanuts"" and ""A Gangster's life"" videos are worth the three bucks alone.",positive
Great fun for an evening on the sofa. Don't expect Academy Award stuff with this but it will leave you with a smile. The performance by Bruce Spence is truly good. The soundtrack shows off some great old Australian talent. Check out this and other true Aussie films.,positive
"You may have serious doubts about watching the third sequel to The Stepford Wifes, but this is an absolute classic. Much scarier in premise than the first, and very entertaining. It only got a video release here in the UK, but should be released worldwide for everyone to enjoy.",positive
"The first hour of the movie was boring as hell. There is no suspense, no action, not even a plot. The movie went no where. I mean they could have made the movie in 15 min short film. Overall, the movie wasn't good at all, and I don't recommend it.",negative
What can I say? I know this movie from start to finish. It's hilarious. It's an strong link to my past and will change the way I view film in the future. Hypothetically speaking :) The down-fall? There's no Socrates Johnson!,positive
"Muscular 'scientists', unpleasantly thin females in swimsuits, lots of beer drinking.. Yet it's too long to be a beer commercial. Oh, okay, there's some plot about a big shark-like monster that's killing people and stuff. But it's nothing you haven't seen before.",negative
This is one of Michael Jackson's best music video's ever made. Vincent Prices rap is totally cool and the zombies dancing with Michael is totally amazing! Michael Jackson is one of my favourite singers and he is one of the best singer's in the world. Way to go Michael!,positive
"Excellent drama about 2 alienated, spoiled punks who go afoul of the federal government, each for his own reasons. One, a druggie, just wants to score some bucks for his next fix, but the other has a far more sinister agenda fueled in part by a resentment of his father. Good performances and a hot script makes this a winner.",positive
This movie is specially for children and I think they will enjoy the movie. For older than 10 the movie is not great but Hilary Swank played very well and without her the movie is very bad but now it gets a 7.,positive
"Although the film is the adaptation of the French play (forgot the name - sorry), it is a wonderful portrayal of the cheerful side of Georgian character. This film will make you to burst into laughter and will fill your heart with warm sadness. It will display the overwhelming love of life along with human eccentricities.",positive
"This movie will kick your ass! Powerful acting in a story that pushes all of us to live out our dreams. Jake Gyllenhaal will go places from here, and the supporting cast was superb. Why would would anyone want to stay in Coalville and develop black lung anyway?",positive
This was stupid funny movie.. Cheech and Chong are the dopiest wasted guys ever... i rate this film a 7.. but if you like this one then go see Jay and Silentbob! There funnier and crazier. Now Cheech is a sellout working on kids movies..... wheres chong?,positive
"This is one gripping movie, reminiscent of the MGM crime movies of the late 70's. Excellent cast, crisp editing and good acting keeps the pace of the movie developing rapidly,. One of the better crime movies of the decade. Kudos to the director & cast.",positive
This movie made me very happy. It's impossible not to love the smart and sweet orphan girl who changes the heart of a selfish lawyer only interested in pursuing success in her career. This is a very optimistic movie and I sincerely believe that we need more films like Curly Sue. It touched my heart.,positive
"One True Thing may have seemed like a horror movie to the yuppies of the 80's, but it doesn't ring true today... unless you happen to be part of a pampered, upper-middle class family which is so insulated from the world that it has never tasted suffering.<br /><br />Avoid this shallow flop.",negative
"This movie is not only the funniest film ever created, it's the greatest. My hats off to Mr. and Mrs. Zodsworth and the rest of the wacky, wacky cast. Good morning Satan, Want a donut? See it post haste! GO SEE IT NOW!",positive
"For all that has been said about the subject matter, and the controversy that surrounded it, please do not overlook what I feel to be the most important part of the film: the salient struggles of everyone to keep their pride through their trials. Whether dealing with self-imposed male braggadocio, a sexual reawakening, or even life itself, everybody is human.",positive
"I felt drawn into the world of the manipulation of mind and will at the heart of the story. The acting by Nolte, Lee, Arkin and the supporting cast was superb. The strange twists in the Vonnegut story are made stranger by odd details.",positive
"Very smart, sometimes shocking, I just love it. It shoved one more side of David's brilliant talent. He impressed me greatly! David is the best. The movie captivates your attention for every second.",positive
"Christopher Lee is one of my favorite actors! I'm trying to view all of his work. He has been known to single-handedly save movies with his presence. Unfortunately, this is not one of them. This movie suffers from a low budget and it's production values are disturbing. Please...for the love of Christopher....avoid this film!",negative
"I thought the movie was great. I thought Kristine DeBell was GREAT and was glad to see her move on into some more interesting roles. I even overlook the fact that the print I have wasn't quite put back together correctly. But, who cares?",positive
This is the first movie I have watched in ages where I actually ended up fast forwarding through the tedious bits which there are plenty of. Very ordinary movie. I'm glad I missed it at the movies & got a 2 for 1 video deal which included this movie instead.,negative
"Sniffing girl's panties kills a guy...and a stupid freaky puppet says a lot of stupid freaky things......My eyes could not leave the screen, my finger could not leave the Fast Forward button....I had to rewatch this spectacle to see if I had really experienced what I thought...I did.....God help us all!",negative
<br /><br />I watched this movie just a little while ago and I found that this movie was terrible! It moved very slowly and was hardly entertaining!<br /><br />Sorry for all those that liked it.... this is only my opinion!,negative
"Leslie Nielson is a very talented actor, who made a huge mistake by doing this film. It doesn't even come close to being funny. The best word to describe it is STUPID!",negative
"I had VERY low expectations for this alleged ""re-imagining"" of the original -- and they weren't even met! What were they thinking? (Answer: They weren't.) Please don't waste your time on this Hollywood trash fest. Clip your nails, balance your checkbook, do anything besides watch this. Remember: If you rent stuff like this, it will only ensure they make more.",negative
"I would love to have that two hours of my life back. It seemed to be several clips from Steve's Animal Planet series that was spliced into a loosely constructed script. Don't Go, If you must see it, wait for the video ...",negative
"all i can say about this film is to read the back of the video case and then put it back on he shelf and pick anything else, i mean anything, a blank video, would be better than watching this.",negative
"That shall be a documentary? I saw it (which is forbidden in Germany) and I have to say, that it was the worst documentary I've ever seen. It is nothing but one big lie from the beginning to the end. Who can doubt after this trash that all Jews were supposed to be killed in the concentration camps?",negative
Rodney Dangerfield is a great. He has done a lot of great works. But this one....is awful. The whole plot is whack. It could have been much better. The jokes in the movie aren't funny....their stupid. This was very not so hilarious. He can do much better than this.,negative
"Like most people, I've seen Jason Priestley on TV and I think he's great. But I didn't know he had a sister! Justine Priestley is simply ""mah""velous as the scorned other woman. Good music, intrigue, and a death scene involving Amanda's revenge on an abusive Dr. that will stay with you for weeks. I'll leave it at that. Kudos.",positive
"A dreary, hopelessly predictable film set in a most unpleasant setting (lower Coachella Valley). Acting is as amateurish as any I've seen. Looks like a screenwriting 101 script. However, it does function as a great sedative.",negative
"I picked up this DVD for $4.99. They had put spiffy cover art on the package, along with a plot summary that had nothing to do with the movie. The acting is terrible, and the writing is worse. The only possible way this movie could be redeemed would be as MST3K fodder. I paid too much.",negative
