review,sentiment
"A wonder. My favorite film. The most important film about relationships ever made. Brilliant writing. Magnificent directing. Image systems and symbolism that leave you thinking about it all days, weeks, years later. Wow. A truly great work of art.",positive
"This is a film exploring the female sexuality in a way not so often used. Almost every other film with this kind of sexual scenes always becomes rated X, and so seen as a pornographic movie. Here is a kind of romantic horror story combined with the females ""own satisfaction"" need.<br /><br />A very good film!",positive
"Low budget horror about an evil force. Hard to believe in this day and age, but way back when this stuff actually used to get theatrical release! These days this sort of thing would either go direct-to-video or straight to cable. Shouldn't be too hard to avoid this one; who's ever heard of it?",negative
"I thought I was going to watch another Friday The 13th or a Halloween rip off, But I was surprised, It's about 3 psycho kids who kill, There's not too many movies like that, I can think of Mikey, Children Of The Corn and a few others, It's not the greatest horror movie but it's a least worth a rent.",positive
this is really films outside (not in a motel room). With real costumes (not only strings and swimsuits). You have to see this movie. it's the only porn movie I know that is worth watching between the sex scenes.<br /><br />Bon Cinema<br /><br />Laurent,positive
"Excellent film dealing with the life of an old man as he looks back over the years. Starting around 1910, he reminisces about his boy and young adulthood; his family, friends, romances, etc. Very nostalgic piece with a bittersweet finale....""all things in life come together as one, and a river runs through it. And that river haunts me."" Worth seeing.",positive
"Serious HOME ALONE/KARATE KID knock off with enough bad character stereotypes to have the writer sued and then shot. You could see blatant stunt man usage in almost every scene. Oh, and the acting sucks too. Although I must say that the line: ""Sorry, dude, I have to take a major dump big time"" made me laugh my ass off.",negative
Anyone who gives this movie less than 8 needs to step outside & puff a couple. Great story.<br /><br />Reality is for people who can't handle drugs.,positive
"Pauline Kael gave this movie a good review but it is terrible. It is very outdated , the humour is silly and the music is forgetable.In fact it is so silly it is almost embarrassing. It might have been some fun in 1938 but I can not imagine anyone enjoying it in 2003.",negative
Most definitely the worst Columbo ever dreamt up. No murder and the abandonment of the tried and tested formula makes this a real drag. Falk looks bored throughout and so will you be if you waste anytime watching this.,negative
"I usually like period films but this one just seemed to drag and drag. I'd perk up during Rupert Graves' scenes, but Vanessa Redgrave just put me to sleep.<br /><br />I was disappointed in the film. It lacked a little ""punch"" at the end that I'd hoped it would have.",negative
"In this Dream-Come-True, I found myself loving what was going on. It's a good movie, and should not be passed off as a corny fantasy movie. It's too smart for that. It's definitely a feel good movie, but with a nice message to leave you with. 7/10, B, **1/2 out of ****",positive
"As a study of the frailties of human nature in the context of old age, this film is without parallel. It is, quite simply, brilliant. Full marks to everyone - from the scriptwriter to all involved in the finished product. You can only marvel at the perceptions inherent in the characterisation of the two ageing performers.",positive
"a hilariously funny movie! of course u gotta have a sense of humour to be able to appreciate it. the music is excellent, reminded me of 50-60's hindi music which is a rarity nowadays... worth the $$$! go check it out :)",positive
"This trio of 30-minute short films on gay-related themes are all quite respectably executed. Each coming-of-age story is played out with pleasant charm and naturalness. This film deserves to be widely distributed and easily obtainable. However, it isn't. I had to order my video copy; none of the local video stores or even the libraries had it in stock.",positive
"This is the definitive movie version of Hamlet. Branagh cuts nothing, but there are no wasted moments.",positive
"Quality entertainment all around. The spectacle of Kermit on his bicycle is one thats as memorable as ANY in cinema history. There's just not a bad thing to be said. Tons of muppets, great cameos, slapstick, puns, whatever you want, its here. The lovers, the dreamers, and me INDEED.",positive
This is a rotten movie.The cast seem to know just how bad it was.it starts badly and by the end is truly bad.the acting is woeful.the script could of been written on the spot.and although the movie is a horror film it has no scary scenes.Crap 1 out of 10,negative
I absolutely loved this movie. It met all expectations and went beyond that. I loved the humor and the way the movie wasn't just randomly silly. It also had a message. Jim Carrey makes me happy. :),positive
"In Theodore Rex poor Whoopi Goldberg is set up as a tough police cop who gets to work with a pathetic dinosaur on a case. The movie tries to be funny, and tries to make a story about abductions and more but it never works. The movie is far from funny, and the story is ridiculous. I voted 1/10",negative
"They just don't make cartoons like they used to. This one had wit, great characters, and the greatest ensemble of voice over artists ever assembled for a daytime cartoon show. This still remains as one of the highest rated daytime cartoon shows, and one of the most honored, winning several Emmy Awards.",positive
My favorite movie. What a great story this really was. I'd just like to be able to buy a copy of it but this does not seem possible.,positive
"Comment this movie is impossible. Is terrible, very improbable, bad interpretation e direction. Not look!!!!!",negative
"I knew this would be one of the worst movies I could have imagined...but in just 20 short minutes it actually exceeded my low expections by being possibly THE worst movie I have ever seen.<br /><br />I have already wasted too much time typing about it...trust me, it sucks.",negative
This is the second and best in the Hunting Trilogy! What makes it the best is the clever dialogue!<br /><br />Bugs: Do you want to shoot me now or wait till you get home?<br /><br />It was kind of funny how they kept that going through out the short!,positive
"Brilliant kung-fu scenes, loads of melodrama, peculiar footwear symbolism and an unhappy (?) end makes Barefoot Kid an unforgettable film.<br /><br />One of the silliest subtitles I've seen...",positive
"So many films are now in a Genre described as ""Comedy/Thriller"", as was this one. A fine cast, interesting premise, but what an unpleasant film to watch. Into Hemp films? Then either ""Saving Grace"" or ""Lock, Stock..."" are far more enjoyable films. Rating: Just 2 out of 10 Roach Clips",negative
"Down To Earth is the best movie!!! It is SO funny, and it's really sweet too. It has a good plot and it's unique. It isn't like those movies that are all the same with the similar story lines, and it's not all comedy and no story. This movie also has a very good ending.",positive
"Sorry, I just didn't find the subject matter as compelling as the filmmaker did. The robot guy and the mole rat guy were pretty interesting, although Morris didn't really tell us much about them. The other two subjects were a bore. And the supposed ""connections"" between them didn't hold up.",negative
"Not a film of entertainment, but of real lives & limited ambition for the working class in 60's. Enjoyable because of my upbringing, not sure it'd work for most people. Typical Loach. Full of TV actors/actresses of 70's/80's/90's.",positive
"This is a true ""feel-good"" movie, full of genuine sweetness and admirable people. Although the premise requires a significant suspension of disbelief, it is worth the trouble to do so. The director, writers, and actors truly convey what it feels like to be in love.",positive
Hobgoblins is a very cheap and badly done Gremlins rip-off. That's the best thing one can say about this stinkpile. Pretty much everyone in the cast was chosen for their looks and not their acting ability. It was very painful to watch.<br /><br />Avoid this one at all costs.,negative
I bought this while I was playing chess in Hastings. I am from Denmark though. It is very good. Definitely with an understanding of the horror genre. The monster towards the end is very scary. People who criticise this on IMDB should recall that it was a huge succes among serious horror critics.<br /><br />,positive
"Out to Sea was a great movie. I expected comedy and from about 10 minutes into the film to the end, there was comedy, and laughing points. Jack and Walter are great together, and the addition of Rue McClanahan made it a wonderful movie, that should be seen over and over again.",positive
This is a superb game for the N64 with superb graphics and a great one-player story-line and even better multi-player game best played with 4 people.<br /><br />The many levels and options for weapons mean that this is one of the best games around for years.,positive
"I enjoyed this movie. Unlike like some of the pumped up, steroid trash that is passed off as action movies, Playing God is simple and realistic, with characters that are believable, action that is not over the top and enough twists and turns to keep you interested until the end.<br /><br />Well directed, well acted and a good story.",positive
"I'd never heard of this movie, but boy was I surprised when I caught it on TV. Great cast, great acting. Excellent movie! How can a movie with William H Macy, Neve Campbell and Donald Sutherland go wrong? I wonder why I never heard of it before.",positive
"Worst movie, (with the best reviews given it) I've ever seen. Over the top dialog, acting, and direction. more slasher flick than thriller.With all the great reviews this movie got I'm appalled that it turned out so silly. shame on you martin scorsese",negative
It is one of the best of Stephen Chow. I give it a nine out of ten.<br /><br />I was surprised to see that Shaolin Soccer was rated on top of all singsing's movies. Unbelievable.,positive
"I could only get through about 25 mins of it. Not one laugh in the 25 minutes I gave it, one of the most painful films I've ever had to endure. Chris Kattan is so nervous on screen that it made me nervous to watch him. Just a horrible movie.",negative
"The story has little to do with Jack London's original novel. I thought the acting was very unnatural, the dubbing was done very sloppily and the story itself contains a fairly large number of inconsistencies and loose ends. Apart from that, the pace of the movie was horrendously slow at some parts.",negative
"This has been one of the best vampire movies that I have seen in a long time. It was very seductive and alluring, I liked that it did not have the usual gore and carnage that comes along with most vampire movies. The music was excellent. It would be great if there was a sequel.",positive
"The whole movie seemed to suffer from poor editing - every scene seemed to take forever to unfold and when they did, I felt like I had waited a long time for very little to happen. I guess I missed the whole point of the movie - either that or there wasn't one.",negative
"the 25th hour was a movie i just chanced upon.tuning in late at night, this movie kept my fascination throughout the entire film.tony quin is this poor unsuspecting guy who just wanted to fall in love with a woman,and by simple jealousy , goes on this incredible journey--terrific movie,and a hidden treasure.",positive
"This is one of the funniest movies that I have seen this year. The people that made it must be so incredibly whacked and twisted. It is a beautiful thing. There were a lot of quality one-liners. This movie blew Uncle Sam out of the water (it was made by tha same people, i think)",positive
Certainly any others I have seen pale in comparison. The series gives balanced coverage to all theatres of operation. No one country is given undue credit for the Allied victory. Laurence Olivier brings great weight and dignity to his role as narrator.,positive
"This was the funniest piece of film/tape I have ever witnessed, bar none. I laughed myself sick the first three times I watched it. I recommend it to everyone, with the warning that if they can't handle the f-sharps to stay FAR away. At his best when telling stories from a kids point of view.",positive
"This one was a surprise and better than most films I've seen recently. Highly enjoyable from start to finish, this is a film that will surely satisfy 99,9% of movie fans worldwide. Great acting from everyone, great script, great story and fantastic plot and twists. Try not to miss it!",positive
"Personally, I think Sayonara was the greatest movie he ever made. It touched every emotion from anger to romance to complete tragedy. And Brando should have won for best actor. Anyway, the movie is awesome, the man is attractive to BOTH MEN AND WOMEN and now you have no reason not to see it! Do so, and fall in love.",positive
"... because while I thoroughly enjoyed this film, it seems from other user comments that I'm in the minority. Maybe not one for the philosopher (eek), there are some wonderful scenes here (- particularly the techno), and the great life adventure story originally portrayed. Go see for yourself!",positive
"Just the ultimate masterpiece in my opinion. Every line, every phrase, every picture is exactly in place and Lindsay Crouse and Joe Mantegna are just THE cool shrink and the sleazy con-man, so well cast. 10 out of 10!",positive
"Ice-T stars as Mason a homeless African-American who finds himself hunted by wealthy hunters (Rutger Hauer,Gary Busey,Charles S. Dutton, F.Murray Abraham,William McNamara and John C. McGinley) however Mason proves to be much harder prey then the usual targets in this ridiculous and slow paced actioner which takes too long setting up actionscenes and then totally botching them.",negative
"It's a good movie if you plan to watch lots of landscapes and animals, like an animal documentary. And making Pierce Brosnan an indian make you wonder 'Does all those people don't recognize if someone isn't indian at plain sight?'",negative
"This is a great film!! The first time I saw it I thought it was absorbing from start to finish and I still do now. I may not have seen the play, but even if I had it wouldn't stop me thinking that the film is just as good.",positive
This sequel to Problem Child is just as bad as the first one. It still teaches kids that it's O.K. to be bad. It's impossible for me to recommend this movie to anyone.,negative
"I can't believe this movie has an average rating of 7.0! It is a fiendishly bad movie, and I saw it when it was fairly new, and I was in the age group that is supposed to like it!",negative
"Richard Farnsworth is one of my favorite actors. He usually gives solid performances, such as in The Straight Story, and The Grey Fox. He also does fairly well here, but the rest of the film suffers from a low budget, poor writing, and so-so photography. The Miller-Movie formula gives it a 4. Richard gets a 5.",negative
"There's nothing wrong with a popcorn movie to keep you off the streets. It's just that some are better than others. This is very poor. The acting is awful, the script dire; and the special effects overrated.<br /><br />Why does Hollywood treat it's audience with such contempt? And why have they made a sequel?",negative
"This movie is one of the best and moving I have ever seen, because of the terrible good performance of the main actress Jennifer Rubin as Jamie Harris, who really makes you feel with her. Also the music by Mark Snow is wonderful.",positive
"before watching this movie my thoughts were like ""another israeli typical movie"" but i was suprised to watch i great israeli drama. the plot is really good and the actors act great. one of the best isreali movies i saw... so at the bottomline i really recommend this movie. :)",positive
"Eddie Izzard is a one-in-a-million comic genius. He goes from squirrels to WWII to Stonehenge to religion to Englebert Humperdink and it's absolutely hilarious and it all makes sense! Get a copy of this now, you won't regret it! I give this an 11 out of 10.",positive
"Mere thoughts of ""Going Overboard"" (aka ""Babes Ahoy"") make me want to weep. Throwing yourself out a window would be better than watching this movie. It's not even a supposed ""so bad it's good"" movie. I would spend money to buy copies of this movie and burn them so that people can't see it. Oh the pain, the pain...",negative
"amazing movie. Some of the script writing could have been better (some cliched language). Joyce's ""The Dead"" is alluded to throughout the movie. Beautiful scenery and great acting. Very poetic. Highly recommend.",positive
This is one of the best romantic movies I have ever seen. Especially girls who can identify with Nicole will love it(not only because of the handsome Dalton James) I also liked the music very much. A highlight was land of the sea and sun from baha-man. So watch the movie and enjoy it,positive
A movie best summed up by the scene where a victim simulates disembowelment by pulling some poor animal's intestines out from under her T-shirt. Too terrible for words.,negative
"The biggest surprise in this movie was the performance of Daryl Hannah. Rather than playing the stereotypical ditzy blonde roles that she usually does she plays a street-smart, intelligent, world-weary character. She doesn't have a huge role but she does a great job portraying Lois Harlan as a woman tired of, although used to, covering up for her boss' indiscretions.",positive
"Brilliant movie. The drawings were just amazing. Too bad it ended before it begun. I´ve waited 21 years for a sequel, but nooooo!!!",positive
"This movie is BAD! It's basically an overdone copy of Michael Jackson's Thriller video, only worse! The special effects consist of lots of glow in the dark paint, freaky slapstick fastmoving camera shots and lots of growling. I think the dog was the best actor in the whole movie.",negative
"A film destined to be on late-night TV long after the present instant ""money-makers"" have long been forgotten. Perhaps a little too subtle for today's youngsters, but in time they'll grow into an appreciation of this movie.",positive
I have to say I quite enjoyed Soldier. Russell was very good as this trained psychopath rediscovering his humanity. Very watchable and nowhere near as bad as I'd been led to believe. Yes it has problems but provides its share of entertainment.,positive
"Gwyneth Paltrow is absolutely great in this movie, but the story is, unfortunately, half-baked, and David Schwimmer's energy is sort of like cold mush. When he closes his mouth and gets serious for a moment or two there is a rush of what-might-have-been. Who thought 25-year-old kiddies would be entertaining?",negative
"Imagine this...<br /><br />Whenever two people meet in this movie, one of them is shot. The plot just does not exist - it appears that someone shot some action sequences and then tried to put them together to make a movie out of it. If you decide to watch it, you will regret it.",negative
"I saw this movie many years ago, and just for kicks decided to rent it and watch it again. The plot is a carbon copy from Fright Night. I did like the hairy vampire and the bug eating driver. Otherwise it was not good at all.",negative
What a stinker!!! I swear this movie was written by a computer that took a whole pile of other movies and merged them all together into this platypus of film. Ouch!,negative
There are about ten minutes about half way through Strangeland when one suddenly sees the glimmer of an interesting idea. Themes of revenge and rehabilitation come into focus during Robert Englund's brief screen time. Sadly Strangeland then resumes its course as a thoroughly predictable and boring slasher film.,negative
"This is a piece of Hollywood product that should have never left a film can. Dialogue without a plausible thought, plot without a point, staging without skill, directing without direction, and acting without the worth of some backwater high school's freshman class play. The entire cast should have been arrested for over acting.<br /><br />But otherwise, okay!",negative
a mesmerizing film that certainly keeps your attention... Ben Daniels is fascinating (and courageous) to watch.,positive
It is a shame that such a great book was turned into such a terrible movie. I could not wait to see this movie after reading the book....it really did not do it justice.,negative
"This movie includes one of the best characters and dialog that Crispin Glover has ever played. Uma Thurman and Suzy Amis are also great in this movie, but Crispin makes it a great depiction of young people trying to make it in New York.",positive
"Come on. The new twist is nearly ok, but from avenging the Elm Street children Freddy is just killing people now. More of the same: Special effects with no actual character development or anything. Simply bad and insulting. SCARY..? Nope. Not at all. Just bad.",negative
"Certainly one of the dozen or so worst movies ever released in any form, featuring a bizarrely abominable performance by Rain Joan of Arc Phoenix (River's sister, inevitably), as Bonanza Jellybean plus inconceivably awful voiceover narration by Tom Robbins, the author of the novel, which had/retains its peculiar sweet/loopy charms.",negative
Rating-10 Classic Waters! One of his best and most shocking films! Divine is THE most filthy person ever! Mink Stole also delivers a superb performance!,positive
"I was really surprised, that my mom watched whole movie without leaving to iron, clean or some other things like these. And I was almost shocked, when she said, it was very funny and very interesting. And I think so.",positive
If you havn't seen this movie I highly recommend you do.It's an excellent true story.I love Alison Lohman she is so talented side note: I also loved her in 7th heaven.The whole story line is amazing and the way they chose there characters waz awesome. The acting in this film is<br /><br />very awesome.,positive
"If you like stupid jokes and a terribly predictable storyline, then perhaps this movie is for you. Courtney Thorne-Smith, Jack Warden, and several other members of the supporting cast actually have talent, but it was completely stifled by the paper-thin script. This is a generally boring and joyless time waster of a movie.",negative
"I don't usually like TV movies, I reckon that if the thing was any good it would make it to Hollywood. This one though is better than average, pretty high production values, a few interesting story twists and some nice shots of NYC (along with Toronto) hold the interest.",negative
"The movie is a bit ""thin"" after reading the book, but it's still one of the greatest movies ever made. Sheryl Lee is beautiful and Nick Nolte is really ""vonneguty"". He makes great job expressing the feelings from the book to the film. Not many films engage the feeling of the book as well as Mother Night does.",positive
"I haven't for a long time seen such a horrible film. I hoped that at least Adam Sandler could be funny... hopeless. Seems, like some teenager have written it's script and he's daddy pushed this so far, that someone agreed to shoot it. (Movie)World could be better place without this, whatever it is.",negative
Sjöströms masterpiece and a movie that captures the swedish soul . It also served as a great inspiration for Bergman; the similarites between Körkarlen and Smultronstället (with Sjöström in the leading role as Isak Borg) from 1957 is not a coincidence. Don't miss it for the world!,positive
"The movie has an excellent screenplay (the situation is credible, the action has pace), first-class direction and acting (especially the 3 leading actors but the others as well -including the mobster, who does not seem to be a professional actor).<br /><br />I wish the movie, the director and the actors success.",positive
The film gets my stamp of approval. The scene in the museum demands acting without dialogue. This is one of the most interesting and unique scenes in the history of film. Dickinson's character Kate is very well developed and her performance is felt throughout the entire film. The best work Angie Dickinson did since Point Blank!,positive
"This is one of my favorite movies of all time. I loved Rain Man with Dustin Hoffman and Tom Cruise. This movie is in some ways similar, but makes Rain Man seem artificial, shallow, unemotional, and trivial by comparison.",positive
"Great cast, great acting, great music. Each character in this movie had their own stories and personalities and it's vivid. A great movie not to be missed.",positive
"I gave this a 2, and it only avoided a 1 because of the occasional unintentional laugh. The film is excruciatingly boring, and incredibly cheap. It's even worse if you know anything at all about the Fantastic Four.",negative
"To quote Flik, that was my reaction exactly: Wow...you're perfect! This is the best movie! I think I can even say it's become my favorite movie ever, even. Wow. I tell you what, wow.",positive
"Without question, the worst ELVIS film ever made. The movie portrays all Indians as drunk, stupid, and lazy. Watch ELVIS's skin change color throughout the film.",negative
